username;date;retweets;favorites;text;geo;mentions;hashtags;id;permalink
xseandlprt17x;2017-10-17 09:32;0;2;"I'ma watch Happy Death Day this Saturday...";;;;"920281439211372544";https://twitter.com/xseandlprt17x/status/920281439211372544
kerolkazama;2017-10-17 09:31;0;0;"Geostorm ? Happy death day ? The Crucifixion ?";;;;"920281035836874754";https://twitter.com/kerolkazama/status/920281035836874754
efhrhm_;2017-10-17 09:30;0;0;"HAPPY DEATH DAY BEST YA ALLAH";;;;"920280904861282304";https://twitter.com/efhrhm_/status/920280904861282304
filmdailyco;2017-10-17 09:30;0;1;"Happy Death Day celebrates killer opening weekend https:// buff.ly/2gp6rz2 #Movies #Filmmaking #News #Screenwriter #Producer #Editor pic.twitter.com/GEwBhP4Fzh";;;#Movies #Filmmaking #News #Screenwriter #Producer #Editor;"920280758866063362";https://twitter.com/filmdailyco/status/920280758866063362
BeritagarID;2017-10-17 09:30;1;1;"#BeritagarHariIni Happy Death Day pukul jatuh Blade Runner 2049 https:// goo.gl/dhq2FZ";;;#BeritagarHariIni;"920280740914491392";https://twitter.com/BeritagarID/status/920280740914491392
Moraes_Vini;2017-10-17 09:30;0;1;"Acabei de assistir happy death day e to apaixonadíssimo pic.twitter.com/Ikk94gjSFg";;;;"920280736720084992";https://twitter.com/Moraes_Vini/status/920280736720084992
dyanaradzie;2017-10-17 09:29;0;0;"Izzah bila bila je onzzz. Jom zannn happy death day . Azan tu busy sangatt mana nak lepak dah skrgg";;;;"920280601072058369";https://twitter.com/dyanaradzie/status/920280601072058369
anatiNasuha;2017-10-17 09:28;0;0;"Happy death day dah tengok belum?";;;;"920280295164620800";https://twitter.com/anatiNasuha/status/920280295164620800
JordanaaW;2017-10-17 09:27;0;0;"I really want to watch Happy Death Day";;;;"920280180039602177";https://twitter.com/JordanaaW/status/920280180039602177
shaziahnabilah;2017-10-17 09:26;0;0;"kemain, tgok happy death day la dulu esok";;;;"920279808180862977";https://twitter.com/shaziahnabilah/status/920279808180862977
prncssblz;2017-10-17 09:24;0;1;"may laban pa gsw & rockets tom :--( showing na rin bad genius & happy death day bukas waaaahhhhttt hahsjsbzibaia!!!!!";;;;"920279239005413377";https://twitter.com/prncssblz/status/920279239005413377
gizatoke;2017-10-17 09:22;0;2;"yop yop buzzin for my exclusive screening of happy death day";;;;"920278877162954753";https://twitter.com/gizatoke/status/920278877162954753
fast_hollywood;2017-10-17 09:21;0;0;"' Happy Death Day ' and Why Horror Movies Are Terrifying Hollywood Studios http:// hollywoodnews.press/039-happy-deat h-day-039-and-why-horror-movies-are-terrifying-hollywood-studios/ …";;;;"920278701224296449";https://twitter.com/fast_hollywood/status/920278701224296449
chickubaby;2017-10-17 09:21;0;0;"Happy Death Day ! (@TGV Cinemas in Petaling Jaya, Selangor) https://www. swarmapp.com/c/6T76KgdliIl pic.twitter.com/sQSh7jOLwa";;@TGV;;"920278648795648002";https://twitter.com/chickubaby/status/920278648795648002
Raekwon_Jenkins;2017-10-17 09:19;1;1;"I’m tryna see that “ Happy Death day ” movie today";;;;"920278112046407680";https://twitter.com/Raekwon_Jenkins/status/920278112046407680
AudioblocksCo;2017-10-17 09:18;0;0;"How it took nearly 10 years to make the #horror movie ' Happy Death Day ' https:// trib.al/uGGga68 #filmmaking pic.twitter.com/jh51e4o0Ub";;;#horror #filmmaking;"920277929103327232";https://twitter.com/AudioblocksCo/status/920277929103327232
freakyfangirl16;2017-10-17 09:18;0;0;"Is it Happy Death Day ?";;;;"920277718943617025";https://twitter.com/freakyfangirl16/status/920277718943617025
MugiwaraLuffy_;2017-10-17 09:17;0;0;"Yeah that too. I personally think Happy Death Day will get old really fast.";;;;"920277617655406598";https://twitter.com/MugiwaraLuffy_/status/920277617655406598
contrapuntovzla;2017-10-17 09:17;0;0;"" Happy Death Day " se adelanta al día de los muertos y reina en la taquilla estadounidense http:// bit.ly/2kUaKDZ pic.twitter.com/flAsm6DU8p";;;;"920277469256589317";https://twitter.com/contrapuntovzla/status/920277469256589317
KOngOnlinefree;2017-10-17 09:16;0;0;"“123Movies! Watch Watch Happy Death Day Full Movie HD-2017” https:// twitter.com/i/moments/9202 76579648864257 …";;;;"920277432094965760";https://twitter.com/KOngOnlinefree/status/920277432094965760
boyyjy;2017-10-17 09:16;0;0;"HAPPY DEATH DAY w (at @TGVCinemas in Kuala Lumpur, WP Kuala Lumpur) https://www. swarmapp.com/c/fo9eBdKDFj0";;@TGVCinemas;;"920277271059091462";https://twitter.com/boyyjy/status/920277271059091462
VersionFinal;2017-10-17 09:16;0;0;"#Espectáculos “ Happy Death Day ” anota otro tanto de recaudación para la factoría Blumhouse http:// bit.ly/2gmLRPU #17Oct pic.twitter.com/MokPLvEh5n";;;#Espect #17Oct;"920277216641957888";https://twitter.com/VersionFinal/status/920277216641957888
lssajoke;2017-10-17 09:15;1;1;"i'm saying! i went to go watch happy death day on sunday and i was very pleased";;;;"920277084110340097";https://twitter.com/lssajoke/status/920277084110340097
RascalFKennedy;2017-10-17 09:15;1;4;"Get Out and Happy Death Day the best horror movies of 2017. Idc.";;;;"920276981454815232";https://twitter.com/RascalFKennedy/status/920276981454815232
clipsonlinetv;2017-10-17 09:14;0;0;"Happy Death Day Box Office: Horror Continues To Totally Kill It In 2017 - Cinema Blend http:// ift.tt/2yPzdAx #Movies #Film";;;#Movies #Film;"920276845525905409";https://twitter.com/clipsonlinetv/status/920276845525905409
AthrhJsni;2017-10-17 09:14;0;1;"Geostorm, escape room, happy death day , flatliners, tombirou. I need extra time tomorrow for movie marathon";;;;"920276800122404869";https://twitter.com/AthrhJsni/status/920276800122404869
alexistaitano;2017-10-17 09:12;0;0;"Happy Death Day was so goooooodddddd I loved it";;;;"920276372655714305";https://twitter.com/alexistaitano/status/920276372655714305
theftmirl;2017-10-17 09:12;0;0;"Happy death day , happy date day (@Golden Screen Cinemas (GSC) - @gscinemas in Shah Alam, Selangor) https://www. swarmapp.com/c/l9xgQF35Ew7";;@Golden @gscinemas;;"920276237507055616";https://twitter.com/theftmirl/status/920276237507055616
brendybossun;2017-10-17 09:11;0;0;"Ah kayaknya Only the Brave tayangnya Jum'at deh, besok Happy Death Day yang tayang..";;;;"920275983604727808";https://twitter.com/brendybossun/status/920275983604727808
contrapuntovzla;2017-10-17 09:10;0;0;"" Happy Death Day " se adelanta al día de los muertos y reina en la taquilla estadounidense http:// bit.ly/2kQUQtQ pic.twitter.com/62hyG6BVxh";;;;"920275709049954304";https://twitter.com/contrapuntovzla/status/920275709049954304
_ItsKaylaBugg;2017-10-17 09:09;0;0;"Happy Death Day is a great movie !";;;;"920275596751654912";https://twitter.com/_ItsKaylaBugg/status/920275596751654912
SmutMatters;2017-10-17 09:09;0;0;"New Movie Review – Happy Death Day http:// bit.ly/2ijc9ml";;;;"920275575373221888";https://twitter.com/SmutMatters/status/920275575373221888
2Drixxy;2017-10-17 09:07;4;2;"I still have to see Boo 2 , Geo Storm and Happy Death Day";;;;"920275154915217408";https://twitter.com/2Drixxy/status/920275154915217408
LawLau_93;2017-10-17 09:07;0;1;"Someone come and see #HappyDeathDay with me please when it's released. I'm too scared to go alone!";;;#HappyDeathDay;"920275053136285696";https://twitter.com/LawLau_93/status/920275053136285696
sharellenicolee;2017-10-17 09:06;0;1;"I want to see happy death day today, but I have no one to go with. cho about to be asked out on a date.";;;;"920274891231854593";https://twitter.com/sharellenicolee/status/920274891231854593
vinilo_negro;2017-10-17 09:06;0;0;"#HappyDeathDay se hace con el #1 en el #BoxOffice USA http:// goo.gl/6THmN3 pic.twitter.com/xdVrjVqXsX";;;#HappyDeathDay #1 #BoxOffice;"920274857572610048";https://twitter.com/vinilo_negro/status/920274857572610048
shirahim;2017-10-17 09:06;0;0;"Happy Death Day ? or ?";;;;"920274785808007169";https://twitter.com/shirahim/status/920274785808007169
ericaisdaname_;2017-10-17 09:02;0;0;"bad genius, happy death day and jigsaw pls huhuhu bisag di pa showing ang isa hahaha gusto nako sila malantaw tanan. cooperate monehh";;;;"920273702658252800";https://twitter.com/ericaisdaname_/status/920273702658252800
pikahw;2017-10-17 09:01;0;0;"Happy death day (@Sushi King in Setapak, Kuala Lumpur) https://www. swarmapp.com/c/9xL8TbXJZOJ";;@Sushi;;"920273673562525696";https://twitter.com/pikahw/status/920273673562525696
WashingtonHisp;2017-10-17 09:01;0;0;"" Happy Death Day " ahuyenta a "Blade Runner" de primer lugar http:// ow.ly/Tdwt30fUF72 pic.twitter.com/UTLJiXf0PL";;;;"920273547074981888";https://twitter.com/WashingtonHisp/status/920273547074981888
ksaxbox;2017-10-17 09:01;0;0;"مراجعة فيلم #HappyDeathDay http:// bit.ly/2zeDx8l pic.twitter.com/z4KLRzwFl8 https:// twitter.com/IGNme/status/9 20273205729943552 …";;;#HappyDeathDay;"920273493748600832";https://twitter.com/ksaxbox/status/920273493748600832
dconheels;2017-10-17 09:01;0;0;"Happy Death Day was number one at the box office over the weekend with $26.04 million. http:// ow.ly/Opct30fVJw4 pic.twitter.com/KPvibSepC4";;;;"920273454087245824";https://twitter.com/dconheels/status/920273454087245824
georgeeeemae;2017-10-17 09:00;0;0;"Happy death day";;;;"920273298092523520";https://twitter.com/georgeeeemae/status/920273298092523520
GoodMenProject;2017-10-17 09:00;0;0;"Happy Death Day tries to be a horror version of a very popular film and although it has some good moments overall... http:// fb.me/CoaPMjhF";;;;"920273208644796417";https://twitter.com/GoodMenProject/status/920273208644796417
IGNme;2017-10-17 09:00;0;3;"مراجعة فيلم #HappyDeathDay http:// bit.ly/2zeDx8l pic.twitter.com/EsIy5DvGqj";;;#HappyDeathDay;"920273205729943552";https://twitter.com/IGNme/status/920273205729943552
uipmoviesph;2017-10-17 09:00;0;0;"MOVIE REVIEW (spoiler free): "An absolute blast" Tag your friends and watch #HappyDeathDay in cinemas TOMORROW! https://www. seattletimes.com/entertainment/ movies/happy-death-day-review-lots-of-horror-fun-in-this-time-loop/?utm_source=RSS&utm_medium=Referral&utm_campaign=RSS_movies …";;;#HappyDeathDay;"920273205096566784";https://twitter.com/uipmoviesph/status/920273205096566784
Universal_NL;2017-10-17 09:00;0;0;"#HappyDeathDay van de makers van The Purge. Nu in de bioscoop. pic.twitter.com/Hk80IkL7w4";;;#HappyDeathDay;"920273191422922752";https://twitter.com/Universal_NL/status/920273191422922752
tonijaiceelene_;2017-10-17 08:59;0;0;"DALI NAAHHHH!!! Ung ano happy death day hahahahahaha";;;;"920273131461255168";https://twitter.com/tonijaiceelene_/status/920273131461255168
whatzittoooyaa;2017-10-17 08:58;0;5;"somebody hook me up with happy death day movie link";;;;"920272862111399936";https://twitter.com/whatzittoooyaa/status/920272862111399936
Drey1818;2017-10-17 08:58;0;1;"Happy Death Day was gooood";;;;"920272854402310144";https://twitter.com/Drey1818/status/920272854402310144
pblovar;2017-10-17 08:57;0;0;"happy death day sis bagi 8/10 pergi la tgk anak anak";;;;"920272539825274882";https://twitter.com/pblovar/status/920272539825274882
TheSundayLife;2017-10-17 08:57;7;10;"We’ve a competion on our Facebook & Instagram pages. 5 pairs of tickets to #HappyDeathDay Wed night at Movie House Dublin Rd & frat party. pic.twitter.com/AM2Yp1RIhn";;;#HappyDeathDay;"920272483617509378";https://twitter.com/TheSundayLife/status/920272483617509378
jaeapril_c;2017-10-17 08:57;0;1;"Saw #HappyDeathDay w/ my Dude. I watched the preview in June & he promised we'd see it. Frkn 3months later, it's finally Oct. Promise kept";;;#HappyDeathDay;"920272467821707265";https://twitter.com/jaeapril_c/status/920272467821707265
SyamilZamrii;2017-10-17 08:56;0;0;"Happy Death Day ni best ke tak eh.";;;;"920272276058079232";https://twitter.com/SyamilZamrii/status/920272276058079232
nrwrdnadyna;2017-10-17 08:56;0;0;"Happy death day !";;;;"920272190125117440";https://twitter.com/nrwrdnadyna/status/920272190125117440
360video_;2017-10-17 08:55;0;0;"Happy Death Day – 360° Video Experience Horror http:// 360video.directory/2017/10/10/hap py-death-day-360-video-experience-horror/ …";;;;"920272178871877632";https://twitter.com/360video_/status/920272178871877632
lyanarahimi;2017-10-17 08:55;0;1;"Happy Death Day night (@MBO Cineplex in Batu Pahat, Johor w/ @nad_yeng ) https://www. swarmapp.com/c/jOMslYK3vH6";;@MBO @nad_yeng;;"920271999389323264";https://twitter.com/lyanarahimi/status/920271999389323264
lilamandamarie;2017-10-17 08:54;0;1;"anyone wanna go see happy death day today";;;;"920271834087641088";https://twitter.com/lilamandamarie/status/920271834087641088
DylChris;2017-10-17 08:53;0;0;"Happy death day was kinda trash but kinda kept me guessing";;;;"920271634795237377";https://twitter.com/DylChris/status/920271634795237377
exoticdouche;2017-10-17 08:53;0;1;"Happy death day #RepublicanAMovie";;;#RepublicanAMovie;"920271449742553089";https://twitter.com/exoticdouche/status/920271449742553089
ButtletDota;2017-10-17 08:52;0;2;"Groundhog Day is a really good movie though, so I'm not totally surprised. That being said, Happy Death Day is unwatchable from title alone.";;;;"920271377332162561";https://twitter.com/ButtletDota/status/920271377332162561
aaaaaaaa6119;2017-10-17 08:52;0;1;"【全米映画ランキング】ホラー「 Happy Death Day 」がV　ジャッキー・チェン主演のアクションは3位に（映画.com） https:// headlines.yahoo.co.jp/hl?a=20171017- 00000019-eiga-movi …";;;;"920271332834545664";https://twitter.com/aaaaaaaa6119/status/920271332834545664
iezalarff;2017-10-17 08:51;0;1;"happy death day is awesome gaisss.";;;;"920271131562557440";https://twitter.com/iezalarff/status/920271131562557440
_mfz97;2017-10-17 08:49;0;1;"Esk gentle pergi tgk happy death day makan seoul garden sorang sorang haha";;;;"920270568196157443";https://twitter.com/_mfz97/status/920270568196157443
crbyerim;2017-10-17 08:48;0;0;"happy death day .";;;;"920270298183647234";https://twitter.com/crbyerim/status/920270298183647234
20inevitable;2017-10-17 08:47;0;3;"Happy death day was so confusing";;;;"920270003236212736";https://twitter.com/20inevitable/status/920270003236212736
mant_a_tangi;2017-10-17 08:46;0;1;"Geostorm and Happy Death Day are both released on Friday and I'll be double-billing them because of course.";;;;"920269717436272640";https://twitter.com/mant_a_tangi/status/920269717436272640
HarrisonSmith85;2017-10-17 08:45;2;6;"With the success of slasher #HappyDeathDay give this slasher throwback a try!";;;#HappyDeathDay;"920269658716024832";https://twitter.com/HarrisonSmith85/status/920269658716024832
nighthinker_;2017-10-17 08:45;0;0;"this is the first day of the rest of your life. happy death day";;;;"920269499617615877";https://twitter.com/nighthinker_/status/920269499617615877
GirlsNextGore;2017-10-17 08:44;1;2;"We give #HappyDeathDayMovie and @UniversalHorror a resounding thumbs up. And a high five. And a https:// twitter.com/universalhorro r/status/919996724969476099 …";;@UniversalHorror;#HappyDeathDayMovie;"920269376259010560";https://twitter.com/GirlsNextGore/status/920269376259010560
RyleyLoser;2017-10-17 08:44;0;0;"Just got out of seeing Happy Death Day . It was decent. I feel like it could have been more fun considering the premise & had way more laughs";;;;"920269189469708289";https://twitter.com/RyleyLoser/status/920269189469708289
nurulhaffiza;2017-10-17 08:43;0;0;""Dik . Jom tngok happy death day " "Kau ajak la jimah" Hmmm idea yg bagus . Ajak junior pompuan kluar la";;;;"920269039754080256";https://twitter.com/nurulhaffiza/status/920269039754080256
D_Khunne;2017-10-17 08:39;1;2;"Happy Death Day and The Babysitter. Both are fine for what they are--pop horror comedies for teenagers.";;;;"920268098741075968";https://twitter.com/D_Khunne/status/920268098741075968
AfiqahMardhiah;2017-10-17 08:39;0;0;"Watch Happy Death Day . It's funny.";;;;"920267950979817479";https://twitter.com/AfiqahMardhiah/status/920267950979817479
Uberdead;2017-10-17 08:37;1;0;"#HappyDeathDay a groundhogs day meets slasher film. Worth seeing.";;;#HappyDeathDay;"920267568383971328";https://twitter.com/Uberdead/status/920267568383971328
DDeqwan;2017-10-17 08:37;0;0;"Happy death day 9/10";;;;"920267493003837442";https://twitter.com/DDeqwan/status/920267493003837442
PersonaRei;2017-10-17 08:36;0;0;"Happy Death Day was cute, but it’s knee-deep in so many stereotypes I can’t figure out whether it wants to be taken seriously or not.";;;;"920267249306419201";https://twitter.com/PersonaRei/status/920267249306419201
KOngOnlinefree;2017-10-17 08:36;0;0;"Watch Happy Death Day (2017) Movie Online Full HDstream IMDB 6.6/10 Release:2017-10-12 Horror, Mystery, Thriller #http:// bit.ly/2yRx8nm";;;#http;"920267192855281665";https://twitter.com/KOngOnlinefree/status/920267192855281665
RenzlerMedia;2017-10-17 08:35;0;0;"‘ Happy Death Day ’ Scares Off ‘Blade Runner’ https:// buff.ly/2gIBClG";;;;"920266930224644096";https://twitter.com/RenzlerMedia/status/920266930224644096
rainyday_abyss;2017-10-17 08:34;0;0;"Happy Death Day !";;;;"920266868803305472";https://twitter.com/rainyday_abyss/status/920266868803305472
afiqahsafwans;2017-10-17 08:34;0;1;"Happy Death Day .";;;;"920266823072849920";https://twitter.com/afiqahsafwans/status/920266823072849920
catLady1111_;2017-10-17 08:34;0;1;"If I (kinda) handled 47 M Down, I'll handle Happy Death Day too. I'll just have to wait a little bit longer: It's not yet been released ly.";;;;"920266760733028352";https://twitter.com/catLady1111_/status/920266760733028352
syzreenathira;2017-10-17 08:33;0;0;"Oh tajuk dia happy death day eh i tot the death day HAHAHAHAHA last mins plan & kau ckp kau balik ptg thats why aku g kalu tk aku teman kau";;;;"920266529962205184";https://twitter.com/syzreenathira/status/920266529962205184
aididnotpray;2017-10-17 08:32;0;1;"Happy Death Day was plotless and it has too many plot holes. No significance or correlations in the reveal. Disappointing.";;;;"920266169914875906";https://twitter.com/aididnotpray/status/920266169914875906
ksaxbox;2017-10-17 08:31;0;0;"شباك التذاكر الأمريكي: #HappyDeathDay يتربع على العرش http:// bit.ly/2ytQZq1 pic.twitter.com/DBt756z84k https:// twitter.com/IGNme/status/9 20265642170712065 …";;;#HappyDeathDay;"920265941736415232";https://twitter.com/ksaxbox/status/920265941736415232
thedigitalgriot;2017-10-17 08:30;0;0;"The latest The Digital Griot Daily! https:// paper.li/thedigitalgrio t/1429381844?edition_id=01b0d9f0-b337-11e7-8e26-0cc47a0d15fd … #happydeathday #starwars";;;#happydeathday #starwars;"920265854851407878";https://twitter.com/thedigitalgriot/status/920265854851407878
findelosmundos;2017-10-17 08:30;10;17;"La divertidísima #HappyDeathDay , número 1 en USA, inaugurará @Nocturnafest . Cruce perfecto entre un slasher y "Atrapado en el tiempo". pic.twitter.com/lCLluFOPj7";;@Nocturnafest;#HappyDeathDay;"920265777672065029";https://twitter.com/findelosmundos/status/920265777672065029
favflicks1;2017-10-17 08:30;0;0;"#HappyDeathDay (2017) – An American Slasher Movie | #dejavu #horror | Read more: http://www. moviewatch1.com/happy-death-da y-2017-an-american-slasher-movie/ … pic.twitter.com/KY09LwU8h6";;;#HappyDeathDay #dejavu #horror;"920265776086638592";https://twitter.com/favflicks1/status/920265776086638592
Arab_News;2017-10-17 08:30;1;2;"‘ Happy Death Day ’ scares off ‘Blade Runner’ at box office http:// j.mp/2yoPARf";;;;"920265741357715456";https://twitter.com/Arab_News/status/920265741357715456
NuarHassan;2017-10-17 08:30;0;1;"Happy Death Day";;;;"920265645102587904";https://twitter.com/NuarHassan/status/920265645102587904
IGNme;2017-10-17 08:30;0;4;"شباك التذاكر الأمريكي: #HappyDeathDay يتربع على العرش http:// bit.ly/2ytQZq1 pic.twitter.com/Tta7XZN9iE";;;#HappyDeathDay;"920265642170712065";https://twitter.com/IGNme/status/920265642170712065
noorool_;2017-10-17 08:28;0;0;"wanna watch happy death day !!!";;;;"920265287873708033";https://twitter.com/noorool_/status/920265287873708033
wanaidazurah;2017-10-17 08:27;0;0;"KAU TAK PERNAH CKP KAU NAK TGK HAPPY DEATH DAY HARI NI pic.twitter.com/yCQhSZqdXq";;;;"920264983354556416";https://twitter.com/wanaidazurah/status/920264983354556416
ceeamparo;2017-10-17 08:25;0;0;"Moral of happy death day : don't be an asshole or someone is going to kill you for it";;;;"920264494311280640";https://twitter.com/ceeamparo/status/920264494311280640
defilmrecensent;2017-10-17 08:24;1;0;"Recensie van Happy Death Day door Liselotte Gertenbach, entertaint! https://www. defilmrecensent.nl/recensie/happy -death-day/liselotte-gertenbach … /cc @Universal_NL pic.twitter.com/abRNBqPfKF";;@Universal_NL;;"920264183681290245";https://twitter.com/defilmrecensent/status/920264183681290245
syazastinson;2017-10-17 08:21;0;1;"#HappyDeathDay was pretty nice. But amazing me, figured out the plot too early ehekkk";;;#HappyDeathDay;"920263494531817472";https://twitter.com/syazastinson/status/920263494531817472
Frunk_1138;2017-10-17 08:20;0;1;"#HappyDeathDay hoef je niet voor de verrassingen of het verhaal te kijken, maar vermakelijk en knap gemaakt is 'ie wel.";;;#HappyDeathDay;"920263331155468289";https://twitter.com/Frunk_1138/status/920263331155468289
LimMiiner;2017-10-17 08:18;0;0;"Happy death day ~ (@Golden Screen Cinemas (GSC) - @gscinemas in George Town, Penang) https://www. swarmapp.com/c/falg5RiQM39";;@Golden @gscinemas;;"920262856578301952";https://twitter.com/LimMiiner/status/920262856578301952
alexxismariiee;2017-10-17 08:17;0;1;"I wanna go see happy death day again";;;;"920262574989565953";https://twitter.com/alexxismariiee/status/920262574989565953
GraveReviewes;2017-10-17 08:17;0;0;"Happy Death Day came out on Friday the 13th, what did you think of the movie?";;;;"920262559449735174";https://twitter.com/GraveReviewes/status/920262559449735174
contrapuntovzla;2017-10-17 08:17;0;0;"" Happy Death Day " se adelanta al día de los muertos y reina en la taquilla estadounidense http:// bit.ly/2kUaKDZ pic.twitter.com/RoBYZKwLPG";;;;"920262368197791744";https://twitter.com/contrapuntovzla/status/920262368197791744
misz_ameyza;2017-10-17 08:16;0;1;"Tak sabar nak tgok cerita Happy Death Day";;;;"920262331900112896";https://twitter.com/misz_ameyza/status/920262331900112896
catLady1111_;2017-10-17 08:16;0;1;"I sure hope Happy Death Day isn't as scary as 47 M Down. Holy! Cow! ( but thank god for a pause icon & good I didn't see it at the )";;;;"920262114727645184";https://twitter.com/catLady1111_/status/920262114727645184
Lisenaaaaa;2017-10-17 08:15;0;0;"I wanna go see Happy Death Day ...";;;;"920261977485860870";https://twitter.com/Lisenaaaaa/status/920261977485860870
TheTruth24US;2017-10-17 08:15;1;0;"" Happy Death Day " scares off "Blade Runner" at box office. #TODAY https:// goo.gl/vFXX9X pic.twitter.com/oxoC37si4S";;;#TODAY;"920261963367833601";https://twitter.com/TheTruth24US/status/920261963367833601
SayaAliaaa;2017-10-17 08:12;0;0;"dak weh cerita happy death day";;;;"920261345487994881";https://twitter.com/SayaAliaaa/status/920261345487994881
casino_news_jp;2017-10-17 08:12;0;0;"【全米映画ランキング】ホラー「 Happy Death Day 」がV ジャッキー・チェン主演のアクションは3位に: 約1284万ドルのOP興収で3位デビューとなったのは、ジャッキー・チェンと「007… http:// dlvr.it/Pw6gbL #カジノ";;;#;"920261250210074624";https://twitter.com/casino_news_jp/status/920261250210074624
IGotLovesCA;2017-10-17 08:12;1;0;"Film ‘ Happy Death Day ’ bercerita tentang seorang mahasiswi (diperankan oleh Jessica Rothe) yang harus menjalani hidup yang menyeramkan -c-";;;;"920261181536854016";https://twitter.com/IGotLovesCA/status/920261181536854016
IGotLovesCA;2017-10-17 08:11;2;0;"1. Happy Death Day pic.twitter.com/5FnfYA0xZF";;;;"920260868377518080";https://twitter.com/IGotLovesCA/status/920260868377518080
contrapuntovzla;2017-10-17 08:10;1;1;"" Happy Death Day " se adelanta al día de los muertos y reina en la taquilla estadounidense http:// bit.ly/2kQUQtQ pic.twitter.com/u8NsdMFPRJ";;;;"920260608783679488";https://twitter.com/contrapuntovzla/status/920260608783679488
mheganalbana;2017-10-17 08:09;13;16;"gustoo nako mutanaw ug " happy death day "";;;;"920260360963108869";https://twitter.com/mheganalbana/status/920260360963108869
faiqzoro;2017-10-17 08:08;0;0;"jom nak tengok happy death day";;;;"920260280533139456";https://twitter.com/faiqzoro/status/920260280533139456
trueviralnews;2017-10-17 08:07;0;0;"Happy Death Day Takes the Box Office with $26.5M #Buzz #Entertainment #NEWS #news http:// wp.me/p7twou-cMGR pic.twitter.com/hw05vPItkK";;;#Buzz #Entertainment #NEWS #news;"920259875539685376";https://twitter.com/trueviralnews/status/920259875539685376
felipemaiaf;2017-10-17 08:07;0;4;"tem um filme no cinema que chama Happy Death Day e os caras traduziram pra A Morte ta de Parabéns...........................................";;;;"920259864798130176";https://twitter.com/felipemaiaf/status/920259864798130176
fu9nrt;2017-10-17 08:06;0;5;"ホラー映画の Happy Death Day 初見でこの画像見た時はギャグ漫画かと思ったわ pic.twitter.com/294OZIN866";;;;"920259622472007680";https://twitter.com/fu9nrt/status/920259622472007680
peesinelevators;2017-10-17 08:05;0;0;"POINT ME TO A HALF PINT OF AMSTERDAM AND A TICKET TO SEE HAPPY DEATH DAY";;;;"920259521955684352";https://twitter.com/peesinelevators/status/920259521955684352
x_izar;2017-10-17 08:05;0;0;"Pakai baju tidur, petang baru mandi Happy death day yg trailer dia keluar dari sekolah tu ek";;;;"920259507774676993";https://twitter.com/x_izar/status/920259507774676993
JujaOnTheBeat;2017-10-17 08:04;0;1;"start na ng Bad Genius bukas pati ng Happy Death Day . Omoo!";;;;"920259287368089600";https://twitter.com/JujaOnTheBeat/status/920259287368089600
