username;date;retweets;favorites;text;geo;mentions;hashtags;id;permalink
itv24_org;2017-10-17 17:02;0;0;"Happy Death Day 2017 Online Download Movie - We Heart It http:// weheartit.com/articles/29952 8389-hq-happy-death-day-2017-online-download-movie … Full Watch Happy Death Day Online… http:// htn.to/fKxPKS";;;;"920394690809151488";https://twitter.com/itv24_org/status/920394690809151488
cristenjansson;2017-10-17 17:02;0;0;"#HappyDeathDay : A literal baby-faced killer. http://www. dailyuw.com/arts_and_leisu re/article_7859ad8a-b2d2-11e7-adca-7bd10ff0294f.html …";;;#HappyDeathDay;"920394670194094080";https://twitter.com/cristenjansson/status/920394670194094080
BuzzyVisuals;2017-10-17 17:01;1;1;"I got 3 free tix to see " Happy Death Day " in ridge hill. Movie starts in 15mins. Pull up on me";;;;"920394446344212480";https://twitter.com/BuzzyVisuals/status/920394446344212480
BUTCHHH99;2017-10-17 17:01;4;7;"I’m Happy death day her roommate was the one killing her.";;;;"920394309383479296";https://twitter.com/BUTCHHH99/status/920394309383479296
CenkBaytinaz;2017-10-17 17:01;0;0;"#nw Happy Death Day (sinemada atamadım şimdi atayım bari)";;;#nw;"920394299367452674";https://twitter.com/CenkBaytinaz/status/920394299367452674
ClearboxPR;2017-10-17 17:01;6;15;"Excited for the special screening of #HappyDeathDay w/ @Universal_Irl tomorrow night @moviehouseni . You’re in for a treat if you’re coming! pic.twitter.com/UYnt3sEhIO";;@Universal_Irl @moviehouseni;#HappyDeathDay;"920394290563637250";https://twitter.com/ClearboxPR/status/920394290563637250
C_Raiaaaaa;2017-10-17 17:00;0;1;"After seeing happy death day I officially want to look like @raylynn93";;@raylynn93;;"920394032190238720";https://twitter.com/C_Raiaaaaa/status/920394032190238720
nickowen2;2017-10-17 16:58;0;1;"happy death day is bad but in a good way";;;;"920393714802950146";https://twitter.com/nickowen2/status/920393714802950146
jaywriting84;2017-10-17 16:56;0;1;"#RepublicanAMovie Happy Death Day . (yeah, it would literally stay the same)";;;#RepublicanAMovie;"920393202502336517";https://twitter.com/jaywriting84/status/920393202502336517
tmpowellCW44;2017-10-17 16:56;1;12;"Thanks to @DrewOnTheRadio for having me on to defend Happy Death Day . http:// bit.ly/2yh2iDt";;@DrewOnTheRadio;;"920393195665723393";https://twitter.com/tmpowellCW44/status/920393195665723393
kgtf22;2017-10-17 16:55;0;0;"2do día consecutivo en el cine. Gracias Ponce. #HappyDeathDay";;;#HappyDeathDay;"920392922067062785";https://twitter.com/kgtf22/status/920392922067062785
kmayer26;2017-10-17 16:55;0;1;"Happy death day , a solid 8.2/10";;;;"920392809244479490";https://twitter.com/kmayer26/status/920392809244479490
Omikron7291;2017-10-17 16:55;0;1;"@jessica_rothe Are you surprised #HappyDeathDay has become number one at the box office this weekend?";;@jessica_rothe;#HappyDeathDay;"920392795222835200";https://twitter.com/Omikron7291/status/920392795222835200
oldgyrrl;2017-10-17 16:54;0;0;"About to see what this is about! #HappyDeathDayMovie — watching Happy Death Day at AMC Theatres Westshore 14 http:// fb.me/8Pq8tJudA";;;#HappyDeathDayMovie;"920392659327430656";https://twitter.com/oldgyrrl/status/920392659327430656
mikaeIuh;2017-10-17 16:53;0;2;"i’m seeing happy death day later tonight will review later";;;;"920392444470022146";https://twitter.com/mikaeIuh/status/920392444470022146
Domichi67;2017-10-17 16:52;0;0;"Happy death day to the father of the country of Haiti. "Jean Jacques Dessalines." Love you much.";;;;"920392094031728640";https://twitter.com/Domichi67/status/920392094031728640
luugabriellee;2017-10-17 16:51;0;0;"gENTE VAMOS ASSISTIR HAPPY DEATH DAY COMIGO POR FAVOR";;;;"920391955963670530";https://twitter.com/luugabriellee/status/920391955963670530
mmjCRACK;2017-10-17 16:51;0;0;"finally seeing Happy Death Day";;;;"920391954994749441";https://twitter.com/mmjCRACK/status/920391954994749441
HalloweenEddie;2017-10-17 16:51;0;0;"I think The Babysitter should have hit theaters. I see more posts about that one than Happy Death Day .";;;;"920391943988715520";https://twitter.com/HalloweenEddie/status/920391943988715520
hyspnoticx;2017-10-17 16:51;0;1;"Marque como visto: Happy Death Day (2017) http:// imdb.com/rg/an_share/ti tle/title/tt5308322/ …";;;;"920391929405345797";https://twitter.com/hyspnoticx/status/920391929405345797
starkanthonys;2017-10-17 16:51;0;3;"friday's cinema jaunt is happy death day (2017)";;;;"920391718456918017";https://twitter.com/starkanthonys/status/920391718456918017
UniPicturesCAN;2017-10-17 16:50;4;3;"#HappyDeathDay is Now Playing! Get tickets: https:// goo.gl/3f4e9y pic.twitter.com/fCIW83MNCg";;;#HappyDeathDay;"920391522276831234";https://twitter.com/UniPicturesCAN/status/920391522276831234
fra_jba;2017-10-17 16:49;0;1;"Oh! Hace mucho tiempo que no veía una película buena. Con un final bueno. Me encantó! @UniversalHorror #FelizDiaDeTuMuerte @CinemarkChile";;@UniversalHorror @CinemarkChile;#FelizDiaDeTuMuerte;"920391388042317825";https://twitter.com/fra_jba/status/920391388042317825
thisisvedo;2017-10-17 16:48;0;0;"I rated Happy Death Day 8/10 on IMDb. Learn more and add it to your Watchlist - http://www. imdb.com/title/tt530832 2/?ref_=prss_rt …";;;;"920391204466028544";https://twitter.com/thisisvedo/status/920391204466028544
rf_sants;2017-10-17 16:48;0;0;"Gonna watch " Happy Death Day ". I know it's gonna be a shitty movie but what else was I gonna do today?";;;;"920391105748848640";https://twitter.com/rf_sants/status/920391105748848640
AIHGamingNews;2017-10-17 16:48;0;0;"With horror movie Happy Death Day reigning at the top of the box office, Halloween season is only going to get spo… http:// ift.tt/2yv6xvd";;;;"920391046252679168";https://twitter.com/AIHGamingNews/status/920391046252679168
FreddyInSpace;2017-10-17 16:48;13;123;"Happy Death Day is one of more creative spins on slasher film. Whole lot of fun & surprisingly touching. Jessica Rothe makes it all work.";;;;"920390987763146754";https://twitter.com/FreddyInSpace/status/920390987763146754
elPeriodicoDM;2017-10-17 16:47;0;1;"“ Happy Death Day ” lidera las taquillas en EE.UU. y Canadá https:// goo.gl/hXnAwU pic.twitter.com/6ehzeeCX5C";;;;"920390777041166336";https://twitter.com/elPeriodicoDM/status/920390777041166336
jessicarothes;2017-10-17 16:47;0;1;"I'm watching Happy Death Day #checkTrakt https:// trakt.tv/movies/happy-d eath-day-2017 … #trakt";;;#checkTrakt #trakt;"920390716571996160";https://twitter.com/jessicarothes/status/920390716571996160
CuteAndSheHoop;2017-10-17 16:45;0;0;"How is Happy Death Day ?";;;;"920390442717515778";https://twitter.com/CuteAndSheHoop/status/920390442717515778
Carlosmave;2017-10-17 16:45;0;0;"Happy Death Day (at @Cinemark_peru in Santiago de Surco, Lima) https://www. swarmapp.com/c/ickKaOe3JD7";;@Cinemark_peru;;"920390358265147393";https://twitter.com/Carlosmave/status/920390358265147393
sydleyloo;2017-10-17 16:45;0;0;"Is Happy Death Day worth seeing in the theater?";;;;"920390320671555584";https://twitter.com/sydleyloo/status/920390320671555584
lailafryy;2017-10-17 16:44;3;3;"Someone please take me to see happy death day :)";;;;"920389971642593287";https://twitter.com/lailafryy/status/920389971642593287
lcina;2017-10-17 16:43;0;0;"Happy death day the day before my “happy birthday!” (@Regal Cinemas Medlock Crossing 18 - @regalmovies ) https://www. swarmapp.com/c/419v9qugrRf";;@Regal @regalmovies;;"920389894924578821";https://twitter.com/lcina/status/920389894924578821
SykoShadow;2017-10-17 16:42;0;0;"In the theatre bout to watch Happy Death Day";;;;"920389527935516675";https://twitter.com/SykoShadow/status/920389527935516675
rejectnation;2017-10-17 16:42;1;6;"' Happy Death Day ' Repeats 'Groundhog Day' Box Office http:// filmschoolrejects.com/happy-death-da y-repeats-groundhog-day-box-office/?utm_campaign=coschedule&utm_source=twitter&utm_medium=rejectnation&utm_content=%27Happy%20Death%20Day%27%20Repeats%20%27Groundhog%20Day%27%20Box%20Office …";;;;"920389470381363201";https://twitter.com/rejectnation/status/920389470381363201
JETROCKETSKATES;2017-10-17 16:41;0;1;"happy death day is ground hog day but solving your own murder see it";;;;"920389436042563584";https://twitter.com/JETROCKETSKATES/status/920389436042563584
TimJKaiser;2017-10-17 16:41;0;0;"Happy Death Day is better than it should be. I’m a sucker for Groundhog Day gimmick. Love it every time";;;;"920389363279769600";https://twitter.com/TimJKaiser/status/920389363279769600
toemab;2017-10-17 16:41;0;1;"Who wants to see Happy Death Day ? lol";;;;"920389344942284800";https://twitter.com/toemab/status/920389344942284800
_ShunMeOut_;2017-10-17 16:41;0;1;"Who seen happy death day ?";;;;"920389235902959621";https://twitter.com/_ShunMeOut_/status/920389235902959621
palacecinemas;2017-10-17 16:41;0;2;"You can see both #HappyDeathDay and #BladeRunner2049 at #PalaceCentral in #Sydney when it opens TOMORROW! https:// thescriptlab.com/features/main/ 7645-importance-marketing-happy-death-days-box-office-victory-blade-runner-2049/ …";;;#HappyDeathDay #BladeRunner2049 #PalaceCentral #Sydney;"920389207960571905";https://twitter.com/palacecinemas/status/920389207960571905
gam_eir;2017-10-17 16:40;0;1;"I saw #happydeathday this evening.....review coming soon #filmreview #horror #horrormovies … https://www. instagram.com/p/BaXOWQtjKss/";;;#happydeathday #filmreview #horror #horrormovies;"920389067702984704";https://twitter.com/gam_eir/status/920389067702984704
twolinepass;2017-10-17 16:40;0;2;"do i want to go see happy death day or the florida project tonite??? plz respond only if u have seen one of these films. thx in advance";;;;"920389006415851521";https://twitter.com/twolinepass/status/920389006415851521
Nisha_Jay97;2017-10-17 16:40;0;2;"I want to get food and see Happy Death Day";;;;"920388974832705536";https://twitter.com/Nisha_Jay97/status/920388974832705536
elgrace7;2017-10-17 16:38;0;1;"I want to see Happy Death Day tn someone go w me!!!!";;;;"920388632510332929";https://twitter.com/elgrace7/status/920388632510332929
Mr24feak;2017-10-17 16:37;0;0;"Watching HAPPY DEATH DAY @5:05Pm For $5.00 Every Tueday In October With The Starpass Card.. – bei Concourse Plaza Multiplex Cinemas";;@5;;"920388372471918593";https://twitter.com/Mr24feak/status/920388372471918593
Kipi_GD;2017-10-17 16:36;0;1;"Oh, and saw trailer of horror movie " Happy Death Day " in cinema, it actually looked interesting. Probably going to check that when it comes";;;;"920388144385667074";https://twitter.com/Kipi_GD/status/920388144385667074
Happinessisgold;2017-10-17 16:36;0;0;"#happydeathday make the main character unlikable at the start so you can redeem her ad the movie commencss.";;;#happydeathday;"920388017185001474";https://twitter.com/Happinessisgold/status/920388017185001474
Phantom6781;2017-10-17 16:35;0;0;"Going to see #HappyDeathDay today! I'm so happy I'm not seeing #ItMovie2017 ! You have no clue how much I don't want to see IT #movienight";;;#HappyDeathDay #ItMovie2017 #movienight;"920387869587509250";https://twitter.com/Phantom6781/status/920387869587509250
DaeDaviDavie;2017-10-17 16:34;0;2;"My roommate made cupcakes and I just watched happy death day ... Ima eat two";;;;"920387675382800384";https://twitter.com/DaeDaviDavie/status/920387675382800384
AmmonMiller;2017-10-17 16:32;0;4;"Wow so Happy Death Day is terrible so far...";;;;"920387129980608512";https://twitter.com/AmmonMiller/status/920387129980608512
Reese_GotDaJuic;2017-10-17 16:32;0;0;"Happy death day";;;;"920387046283366400";https://twitter.com/Reese_GotDaJuic/status/920387046283366400
jameslipton033;2017-10-17 16:32;0;0;"How ' Happy Death Day ' Almost Ended http:// ift.tt/2xMpavN";;;;"920386935700508677";https://twitter.com/jameslipton033/status/920386935700508677
thisisvedo;2017-10-17 16:30;0;3;"Happy Death Day herşeye rağmen çok güzeldi puanım 8/10 pic.twitter.com/vhij729g8p";;;;"920386638089457665";https://twitter.com/thisisvedo/status/920386638089457665
filmfreak75;2017-10-17 16:30;0;0;"representing @filmfreakmafia at screening of #HappyDeathDay courtesy of @moviepass (@AMC Pacific Place 11) https://www. swarmapp.com/c/kd5ltSDshR0";;@filmfreakmafia @moviepass @AMC;#HappyDeathDay;"920386620129464320";https://twitter.com/filmfreak75/status/920386620129464320
CinemaSalem;2017-10-17 16:29;0;0;"We'll also be showing Happy Death Day this week, starting Friday! Tickets on sale now. Lego Ninjago and Stronger will be leaving as well. pic.twitter.com/sxzWhgVQmY";;;;"920386405012004875";https://twitter.com/CinemaSalem/status/920386405012004875
love_belfast;2017-10-17 16:29;15;12;"LIKE TO WIN? #HappyDeathDay 5 winners! Win tickets to the Frat Party and Cinema RT and CLICK http:// bit.ly/happydday pic.twitter.com/tSZdMKG0mK";;;#HappyDeathDay;"920386266251882497";https://twitter.com/love_belfast/status/920386266251882497
ZillaZomber2;2017-10-17 16:29;0;0;"Me ha gustado un vídeo de @YouTube ( http:// youtu.be/ce_hc_5Cn3M?a - La Impactante Historia Oculta en Happy Death Day -Eterno Retorno).";;@YouTube;;"920386238821040130";https://twitter.com/ZillaZomber2/status/920386238821040130
_hemmhemm;2017-10-17 16:28;0;0;"Alguém q me leve a ver Happy Death Day , obrigada de nada";;;;"920386137230921728";https://twitter.com/_hemmhemm/status/920386137230921728
FieerLara;2017-10-17 16:25;2;1;"ik heb iemand nodig om Happy Death Day mee te kijken lol";;;;"920385286881804295";https://twitter.com/FieerLara/status/920385286881804295
clipsonlinetv;2017-10-17 16:24;0;0;"Box office: Happy Death Day takes down Blade Runner 2049 - http:// EW.com http:// ift.tt/2xMrga5 #Movies #Film";;;#Movies #Film;"920385028059750400";https://twitter.com/clipsonlinetv/status/920385028059750400
JessAnderson95;2017-10-17 16:24;0;0;"Going to see Happy Death day with bae";;;;"920385018274426880";https://twitter.com/JessAnderson95/status/920385018274426880
WilliamBibbiani;2017-10-17 16:24;0;20;"Also ANNABELLE: CREATION, HAPPY DEATH DAY , DON’T KILL IT, CURSE OF CHUCKY. (Haven’t seen MOTHER or SHAPE OF WATER yet.)";;;;"920384925387206656";https://twitter.com/WilliamBibbiani/status/920384925387206656
MizBellaBlack;2017-10-17 16:23;0;0;"Come celebrate our amazing client Scott Lobdell's hit horror film Happy Death Day with us at Round2LA - Fashion... http:// fb.me/QSfSr6CA";;;;"920384753005576192";https://twitter.com/MizBellaBlack/status/920384753005576192
__superkamiguru;2017-10-17 16:23;1;4;"Movies later? Happy death day is out and it looks good as fuck";;;;"920384735020535813";https://twitter.com/__superkamiguru/status/920384735020535813
nick_malbeuf;2017-10-17 16:22;1;2;"HAPPY DEATH DAY is actually a lot of silly fun. I enjoyed it quote a bit.";;;;"920384582389764097";https://twitter.com/nick_malbeuf/status/920384582389764097
civilgorepod;2017-10-17 16:21;0;1;"HAPPY DEATH DAY was a fun throwback to 90s slashers. PG-13 rating hurt it a bit, but still had a great time.";;;;"920384316517048320";https://twitter.com/civilgorepod/status/920384316517048320
faiedanish;2017-10-17 16:21;0;1;"Perhhh happy death day dah keluar laa!!! Nak tengok pleasee";;;;"920384195712532482";https://twitter.com/faiedanish/status/920384195712532482
Luafnova_;2017-10-17 16:20;0;1;"Alguém me leva pra ver Happy Death Day pff cof cof";;;;"920384050849861632";https://twitter.com/Luafnova_/status/920384050849861632
AlinaflorisX;2017-10-17 16:18;0;0;"Happy death day .";;;;"920383471608107013";https://twitter.com/AlinaflorisX/status/920383471608107013
Screen_Queens;2017-10-17 16:18;2;0;"Happy Wednesday! This week we review surprise horror hit HAPPY DEATH DAY http:// silverscreenqueens.com/231 pic.twitter.com/PJblCjLtyv";;;;"920383438758088705";https://twitter.com/Screen_Queens/status/920383438758088705
homerpower2000;2017-10-17 16:18;0;1;"#NowWatching #HappyDeathDay pic.twitter.com/Iyx5R0jnNS";;;#NowWatching #HappyDeathDay;"920383428159332352";https://twitter.com/homerpower2000/status/920383428159332352
sebassy_;2017-10-17 16:17;1;0;"Like I know this sounds so crazy but I just saw #HappyDeathDay & it was exactly the movie I needed to see.";;;#HappyDeathDay;"920383290120454144";https://twitter.com/sebassy_/status/920383290120454144
purplemaplegame;2017-10-17 16:17;0;1;"SPOILING EVERYTHING: HAPPY DEATH DAY : http:// youtu.be/kli18xVdVCM?a via @YouTube";;@YouTube;;"920383233317134336";https://twitter.com/purplemaplegame/status/920383233317134336
trailer_watch;2017-10-17 16:16;0;0;"Happy Death Day ALL Trailers + Clips (2017) | Movieclips Trailer https:// youtu.be/dAzuZ-V81I0 via @YouTube";;@YouTube;;"920383040156782592";https://twitter.com/trailer_watch/status/920383040156782592
sebassy_;2017-10-17 16:15;0;1;"Big fan of @israelbroussard since #theblingring & I loved seeing him in #HappyDeathDay #greatmovie";;@israelbroussard;#theblingring #HappyDeathDay #greatmovie;"920382869536620544";https://twitter.com/sebassy_/status/920382869536620544
j_ceperley;2017-10-17 16:14;0;0;"It’s looking like fall outside, so I’m inside watching movies. First up, #HappyDeathDay .… https://www. instagram.com/p/BaXLP3jgLE0/";;;#HappyDeathDay;"920382626564894720";https://twitter.com/j_ceperley/status/920382626564894720
jasminrodri9963;2017-10-17 16:14;0;0;"“ Happy Death Day ” de primera en las taquillas de EE.UU. y Canadá http:// ow.ly/WNH030fWDzY pic.twitter.com/2DeCgu3nvU";;;;"920382494276505600";https://twitter.com/jasminrodri9963/status/920382494276505600
sebassy_;2017-10-17 16:12;1;1;"Just #HappyDeathDay with @thatsdopetho & we both loved it. Laughed, screamed, we even teared up. #GoSeeIt pic.twitter.com/v0PRFpsbfe";;@thatsdopetho;#HappyDeathDay #GoSeeIt;"920381930067058689";https://twitter.com/sebassy_/status/920381930067058689
Chel0__;2017-10-17 16:11;0;0;"Happy Death Day Estuvo mucho mejor de lo q esperaba";;;;"920381717214527491";https://twitter.com/Chel0__/status/920381717214527491
TheRyanMacLean;2017-10-17 16:10;0;1;"watch Happy Death Day";;;;"920381476927029248";https://twitter.com/TheRyanMacLean/status/920381476927029248
RaulMartinezP3;2017-10-17 16:10;0;0;"“ Happy Death Day ” de primera en las taquillas de EE.UU. y Canadá http:// ow.ly/WNH030fWDzY pic.twitter.com/YOaioyiSSN";;;;"920381454781206528";https://twitter.com/RaulMartinezP3/status/920381454781206528
breonnadbrooks;2017-10-17 16:09;0;0;"is Happy Death Day good?";;;;"920381359528513538";https://twitter.com/breonnadbrooks/status/920381359528513538
gmvieiraa;2017-10-17 16:09;0;0;"Tô bolado happy death day nem foi tudo isso";;;;"920381256864583688";https://twitter.com/gmvieiraa/status/920381256864583688
cartoondeath;2017-10-17 16:08;0;0;"This was my initial tweet. Happy Death Day is the one I was referring to apparently being a really good fun and smart slasher";;;;"920381105752158208";https://twitter.com/cartoondeath/status/920381105752158208
erskinerecords;2017-10-17 16:08;0;1;"happy death day";;;;"920381105672458241";https://twitter.com/erskinerecords/status/920381105672458241
mynameJakeva_;2017-10-17 16:08;1;0;"wanna go see happy death day ..";;;;"920381014702198784";https://twitter.com/mynameJakeva_/status/920381014702198784
BuboMusic;2017-10-17 16:08;0;0;"Para que no me la cuenten — watching Happy Death Day at Plaza Las Américas http:// fb.me/8KX6c4Ny2";;;;"920380924973400064";https://twitter.com/BuboMusic/status/920380924973400064
The_lame_gedric;2017-10-17 16:07;0;0;"Happy death day sucked";;;;"920380760200159232";https://twitter.com/The_lame_gedric/status/920380760200159232
Mooie_Mooie9;2017-10-17 16:06;0;0;"Movies with my kids #HappyDeathDay";;;#HappyDeathDay;"920380513839468544";https://twitter.com/Mooie_Mooie9/status/920380513839468544
_Stephyy17;2017-10-17 16:05;0;0;"Happy death day is such a good movie!! I recommend you guys watch :))";;;;"920380362727002113";https://twitter.com/_Stephyy17/status/920380362727002113
LaflacaAilad;2017-10-17 16:05;0;0;"Me dice que te pareció, es mala en mi opinión";;;;"920380276060061696";https://twitter.com/LaflacaAilad/status/920380276060061696
noticias24;2017-10-17 16:05;1;2;"“ Happy Death Day ” de primera en las taquillas de EE.UU. y Canadá http:// ow.ly/WNH030fWDzY pic.twitter.com/99EApBaSSl";;;;"920380270792015877";https://twitter.com/noticias24/status/920380270792015877
Caleb_Brentley;2017-10-17 16:05;0;0;"Happy Death Day was still pretty interesting";;;;"920380269768605696";https://twitter.com/Caleb_Brentley/status/920380269768605696
creetureshow;2017-10-17 16:05;5;19;"Thanks Ben!!!";;;;"920380227749998592";https://twitter.com/creetureshow/status/920380227749998592
Wildswood;2017-10-17 16:04;0;0;"Three Funerals and a Christmas The Castrations Jeffrey Dahmer Throws a Party Three Jacka**es for Sister Sara Happy Death Day 3 Despicable 3";;;;"920379996786524160";https://twitter.com/Wildswood/status/920379996786524160
LaflacaAilad;2017-10-17 16:04;0;0;"Happy death day , esta película es mala , no la recomiendo, yo mire el trailer, tenía muchas expectativas y 0 que ver.";;;;"920379950741499905";https://twitter.com/LaflacaAilad/status/920379950741499905
MeganMeganlum;2017-10-17 16:03;0;4;"love this movie.";;;;"920379860505300992";https://twitter.com/MeganMeganlum/status/920379860505300992
pzullicious;2017-10-17 16:03;0;0;"Apa pun, Happy Death Day actually has a drastic change mood from scary to action movies.";;;;"920379770277208064";https://twitter.com/pzullicious/status/920379770277208064
Mary_december19;2017-10-17 16:03;0;0;"happy death day の予告動画見てしまった 観たいけど怖い";;;;"920379682704441344";https://twitter.com/Mary_december19/status/920379682704441344
panainforma;2017-10-17 16:02;0;0;"Cine y Cultura: Film de horror " Happy Death Day " desplaza a "Blade Runner" en la taquilla https:// panamainforma.com/index.php/entr etenimiento/cine-y-cultura/4642-film-de-horror-happy-death-day-desplaza-a-blade-runner-en-la-taquilla.html … pic.twitter.com/PwAJdF9GlK";;;;"920379594095636480";https://twitter.com/panainforma/status/920379594095636480
ScottWamplerBMD;2017-10-17 16:02;2;32;"(performs home lobotomy after having the ringtone from HAPPY DEATH DAY stuck in my head for four days)";;;;"920379450839224321";https://twitter.com/ScottWamplerBMD/status/920379450839224321
BubblegumDean;2017-10-17 16:01;0;0;"@jessica_rothe happy death day was so good!!! u killed it";;@jessica_rothe;;"920379362754605056";https://twitter.com/BubblegumDean/status/920379362754605056
joshuacolonn;2017-10-17 16:00;0;2;"Dollar burger night & happy death day finally!";;;;"920379104574234624";https://twitter.com/joshuacolonn/status/920379104574234624
briannaaboom;2017-10-17 16:00;0;0;"solo movie (@AMC Southcenter 16 - @amctheatres for Happy Death Day in Tukwila, WA) https://www. swarmapp.com/c/bPS78boIjzF";;@AMC @amctheatres;;"920379011309727746";https://twitter.com/briannaaboom/status/920379011309727746
thehoya;2017-10-17 16:00;1;2;"MOVIE REVIEW: " Happy Death Day " features great cinematography but lacks character development. http://www. thehoya.com/movie-review-h appy-death-day/ …";;;;"920379001692217344";https://twitter.com/thehoya/status/920379001692217344
kendravanlinter;2017-10-17 16:00;0;0;"to go see happy death day tonight..or IT again since jalene aint see it yet";;;;"920378992179507201";https://twitter.com/kendravanlinter/status/920378992179507201
TerranceJBynum;2017-10-17 16:00;1;5;"#HappyDeathDay was actually really funny. Kind of want to see it again.";;;#HappyDeathDay;"920378973527228416";https://twitter.com/TerranceJBynum/status/920378973527228416
Playboy;2017-10-17 16:00;12;68;"#HappyDeathDay is another win for @blumhouse , could we be on the cusp of a slasher renaissance? http:// ply.by/trDm2j pic.twitter.com/wVA9vfbVhq";;@blumhouse;#HappyDeathDay;"920378911992827906";https://twitter.com/Playboy/status/920378911992827906
i_bern_em;2017-10-17 15:59;0;0;"who saw Happy Death Day and is it worth it?";;;;"920378809970544640";https://twitter.com/i_bern_em/status/920378809970544640
minute5072;2017-10-17 15:59;0;0;"Might see Happy Death Day too cos I'm a sucker for a time loop";;;;"920378747064332288";https://twitter.com/minute5072/status/920378747064332288
XxRetroZoMBiexX;2017-10-17 15:58;0;1;"Boiling Crab and Happy Death Day today";;;;"920378562481242112";https://twitter.com/XxRetroZoMBiexX/status/920378562481242112
salkire9;2017-10-17 15:54;0;3;"I'm tryna go see happy death day in a panda and/or lion onesie ok";;;;"920377423459508224";https://twitter.com/salkire9/status/920377423459508224
WyattJacks0n;2017-10-17 15:53;0;0;"@Strack_W23 so we gonna watch happy death day or you just gonna talk about it all the time?";;@Strack_W23;;"920377343558017025";https://twitter.com/WyattJacks0n/status/920377343558017025
Saultoodope69;2017-10-17 15:53;1;1;"Let’s go see happy death day";;;;"920377299811254277";https://twitter.com/Saultoodope69/status/920377299811254277
ashleydragulaa;2017-10-17 15:53;0;1;"Happy death day just looks frustrating";;;;"920377135075811329";https://twitter.com/ashleydragulaa/status/920377135075811329
DarkUgh;2017-10-17 15:52;0;1;"#Filmreview Happy Death Day ★★★★ Romantic morality feel good slasher movie knowingly rips off Ground Hog day. Avoids gore. Still has jumps pic.twitter.com/mVaZ5jCDGE";;;#Filmreview;"920377032319500289";https://twitter.com/DarkUgh/status/920377032319500289
angelahubain;2017-10-17 15:52;0;0;"https:// youtu.be/zix4aMOKwrM #happydeathday";;;#happydeathday;"920376913792712704";https://twitter.com/angelahubain/status/920376913792712704
solahgatei;2017-10-17 15:51;0;0;"A Cheap Seats Movie Review: Happy Death Day Watch Now http:// inf-o-cpns.blogspot.com/2017/10/a-chea p-seats-movie-review-happy-death.html … pic.twitter.com/yDX7Sy9UFh";;;;"920376819764805632";https://twitter.com/solahgatei/status/920376819764805632
HelenaFreitasR;2017-10-17 15:51;0;0;"Taquilla USA: ‘Feliz día de tu muerte / Happy Death Day ’ arrebata a 'Blade Runner2049' el liderazgo http:// grancine.net/noticias-detal … @Gran_Cine";;@Gran_Cine;;"920376814798888960";https://twitter.com/HelenaFreitasR/status/920376814798888960
