,username,date,retweets,favorites,text,mentions,hashtags,id,Compound_Score,Negative_Score,Positive_Score,Neutral_Score
1797,younottherr,2017-10-20 03:45,0,0,happy death day stupid ass movie,,,921281168393121792,-0.7964,0.655,0.224,0.121
1798,Universal_Irl,2017-10-20 03:45,13,76,cinemas book,,#HappyDeathDay,921281083039211520,0.0,0.0,0.0,1.0
1799,AinunKharisma,2017-10-20 03:43,0,0,watching happy death day fauziah,,,921280586534109185,-0.0516,0.368,0.349,0.283
1800,muhdsyafiq1453,2017-10-20 03:41,0,0,happy death day pun best la la tngok,,,921280275572649984,0.6124,0.232,0.47,0.298
1801,Christen_MM,2017-10-20 03:40,0,6,okay happy death day good,,,921279849242734592,0.5574,0.291,0.634,0.075
1802,luckypoin7,2017-10-20 03:39,1,1,quote pemuda cakep ngga usah maksa dating ce,,#HappyDeathDay,921279662856159232,0.0,0.0,0.0,1.0
1803,muizzmustaffa,2017-10-20 03:39,0,0,happy death day ni aku kasi,,,921279629532344321,-0.0516,0.336,0.319,0.345
1804,sectumzempra,2017-10-20 03:37,0,0,happy death day like high quality b movie n complaining lmao,,,921279259230003200,0.6597,0.288,0.51,0.202
1805,topukfilms,2017-10-20 03:36,0,1,top blade runner top new release happy death day top lego ninjago top mountain us film avoid snowman,,,921278883219066880,0.4215,0.218,0.389,0.393
1806,MrNew1,2017-10-20 03:36,0,15,believe paid money see happy death day,,,921278877409800192,-0.0516,0.31,0.294,0.397
1807,Sufie910,2017-10-20 03:36,0,0,happy death day mcm seronok,,,921278862780071939,-0.0516,0.368,0.349,0.283
1808,Kandrakarx,2017-10-20 03:35,0,0,want watch bad genius happy death day wallet kindah broke rn,,,921278754646769665,-0.7351,0.481,0.236,0.283
1809,topukfilms,2017-10-20 03:34,0,1,blade runner lego ninjago movie goodbye christopher robin ritual golden circle happy death day,,,921278313326350336,-0.0516,0.199,0.189,0.612
1810,sayuriportillo1,2017-10-20 03:33,0,3,ethen taking see happy death day rn trippy,,,921278084657037312,-0.0516,0.287,0.272,0.441
1811,nursouraya,2017-10-20 03:32,3,7,bestfriend decided settle guy less carter happy death day,,,921278002444386304,-0.0553,0.259,0.243,0.498
1812,MediaShockUK,2017-10-20 03:32,0,0,go ya death,,#HappyDeathDay #FridayFeeling,921277932701700096,-0.5994,0.661,0.0,0.339
1813,pinkrockstyles,2017-10-20 03:31,0,2,okay im watch happy death day youll see break flicker bedroom floor hours love,,,921277713175810048,0.7096,0.165,0.414,0.422
1814,meoha94,2017-10-20 03:30,0,0,torn happy death day bad genius,,,921277358249623554,-0.6908,0.623,0.245,0.132
1815,DuniakuNet,2017-10-20 03:30,1,0,review happy death day ketika mati menjadi seru,,,921277347029856257,-0.0516,0.287,0.272,0.441
1816,TheLightWirral,2017-10-20 03:30,0,0,new today book,,#HappyDeathDay #EarthOneAmazingDay #Geostorm #TheDeathofStalin #Wirral,921277313614049281,0.0,0.0,0.0,1.0
1817,vylizardo,2017-10-20 03:29,0,1,sa happy death day,,,921277207527305216,-0.0516,0.406,0.385,0.208
1818,vylizardo,2017-10-20 03:29,0,0,sa happy death day kasi toooo hahahaha,,,921277156516249600,-0.0516,0.31,0.294,0.397
1819,ditasauwi,2017-10-20 03:28,0,0,penasaran ama happy death day,,,921276987322220544,-0.0516,0.368,0.349,0.283
1820,DEF_S0UL94,2017-10-20 03:28,0,0,happy death day,,,921276895378882560,-0.0516,0.453,0.43,0.116
1821,dextertay,2017-10-20 03:27,0,0,happy death day cinemas petaling,@MBO,,921276737165684736,-0.0516,0.368,0.349,0.283
1822,Hokahokaland,2017-10-20 03:27,0,0,happy death day,,,921276716739215361,-0.0516,0.453,0.43,0.116
1823,TarizSolis,2017-10-20 03:27,1,3,dan sangat ulasan untuk,,#HappyDeathDay,921276665652830209,0.0,0.0,0.0,1.0
1824,Big_John_T1987,2017-10-20 03:27,0,0,liked video happy death day movie review maniacal cinephile,@YouTube,,921276616520675328,0.3182,0.311,0.389,0.299
1825,MediaShockUK,2017-10-20 03:27,0,0,uk,,#HappyDeathDay #NowPlaying,921276573306810369,0.0,0.0,0.0,1.0
1826,steIliferous,2017-10-20 03:26,0,0,happy death day win,,,921276472681119745,0.5574,0.315,0.605,0.081
1827,babeltea,2017-10-20 03:26,0,0,happy death day greget njay,,,921276367978741760,-0.0516,0.368,0.349,0.283
1828,_alifhaikal7,2017-10-20 03:25,0,0,happy death day ous screen cinemas kuala wp kuala,@Golden @gscinemas,,921276263469285376,0.2023,0.25,0.365,0.385
1829,afiqah93,2017-10-20 03:23,0,0,happy death day teaches frnds enemy shld say fake,,#happydeathday,921275747150413824,-0.7783,0.547,0.193,0.26
1830,TheJuggernaut93,2017-10-20 03:23,0,1,lol waiting happy death day movie trailer,,#movie #JusticeLeague,921275541361106944,0.3818,0.271,0.451,0.278
1831,itsmecharfaye,2017-10-20 03:22,0,0,still watched happy death day geostorm,,,921275413208342528,-0.0516,0.336,0.319,0.345
1832,sidiq_plantmana,2017-10-20 03:22,0,0,di semarang ada smp nonton happy death day pantes film yang dapat rating masih tetap,,,921275300058505217,-0.0516,0.189,0.18,0.631
1833,cldttx,2017-10-20 03:21,0,12,happy death day foreigner tapos bad genius ang gaganda ng mga showing ngayooooon,,,921275178729873409,-0.5719,0.351,0.175,0.474
1834,Danny11M,2017-10-20 03:21,0,1,excited happy death day thor time,,,921275144022253568,0.296,0.3,0.469,0.231
1835,yvngambs,2017-10-20 03:20,0,0,went c happy death day,,,921275016934649856,-0.0516,0.406,0.385,0.208
1836,sibbywhyy,2017-10-20 03:19,0,0,happy death day,,,921274778471632897,-0.0516,0.453,0.43,0.116
1837,josephnomenick,2017-10-20 03:17,0,1,gsto ko mg watch bad genius happy death day,,,921274244499046400,-0.5719,0.433,0.216,0.351
1838,soulessass,2017-10-20 03:17,0,1,corn happy death day scary pumpkin patch bitch,,,921274223888277504,-0.802,0.586,0.199,0.215
1839,gioglenn23,2017-10-20 03:17,0,0,happy death day yung bago mukhang maganda libre,,,921274032351088640,-0.0516,0.287,0.272,0.441
1840,PLE4SURES,2017-10-20 03:16,0,0,yall watch happy death day,,,921273897575596032,-0.0516,0.368,0.349,0.283
1841,jihoonpkr,2017-10-20 03:15,0,0,thor justice happy death day ke,,#RIPpengeluaran,921273678674804736,0.4939,0.279,0.507,0.214
1842,SilverbirdFilmD,2017-10-20 03:14,0,0,finally showing,,#HappyDeathDay #theaters #HappyDeathDayMovie #JessicaRothe,921273409828540416,0.0,0.0,0.0,1.0
1843,jonocard,2017-10-20 03:14,6,6,happy death day groundhog day,,,921273377544908800,-0.0516,0.368,0.349,0.283
1844,lv21mall,2017-10-20 03:11,0,0,playing level happy death day seorang mahasiswa,,,921272690157035520,0.1531,0.291,0.41,0.299
1845,JanahJaysine,2017-10-20 03:10,0,0,guato ko talagang manood ng happy death day huhuhu,,,921272470874636288,-0.0516,0.267,0.253,0.479
1846,russelloviedo,2017-10-20 03:10,0,0,maganda naman happy death day ah,,,921272385050877952,-0.0516,0.336,0.319,0.345
1847,neilstudd,2017-10-20 03:05,0,0,geostorm happy death day reckon need fill first,,,921271227477610496,-0.0516,0.287,0.272,0.441
1848,aaainnnn_,2017-10-20 03:05,0,0,happy death day great,,,921271153695498242,0.5994,0.307,0.614,0.079
1849,coIinfcrrell,2017-10-20 03:05,0,0,im seeing happy death day tonight conflicted,,,921271071550124032,-0.0516,0.31,0.294,0.397
1850,ANA42111785,2017-10-20 03:04,0,0,wanna watch happy death day,,,921270839055564801,-0.0516,0.368,0.349,0.283
1851,sourpatchskata,2017-10-20 03:03,0,2,going watch happy death day today hope b great,,,921270757497253888,0.7783,0.21,0.575,0.215
1852,Belfasttimes,2017-10-20 03:03,1,0,movie happy,,,921270685183361024,0.5719,0.0,0.787,0.213
1853,MsStalkers,2017-10-20 03:01,0,0,happy death day yuk,,,921270227219791874,-0.0516,0.406,0.385,0.208
1854,Cissitaa15,2017-10-20 03:01,0,0,saw happy death day,,,921270171121082368,-0.0516,0.406,0.385,0.208
1855,asifzjjmat,2017-10-20 03:01,0,0,happy death day,,,921270074454851590,-0.0516,0.453,0.43,0.116
1856,LightSheffield,2017-10-20 03:00,0,0,new today got,,#HappyDeathDay #MyLittlePony #DeathOfStalin #Geostorm,921269769415872513,0.0,0.0,0.0,1.0
1857,avvxm_,2017-10-20 02:58,0,0,happy death day good movie,,,921269438434783232,0.4019,0.312,0.528,0.16
1858,Stephen_702,2017-10-20 02:58,0,1,happy death day surprisingly enjoyable,,,921269355031044096,0.5994,0.285,0.642,0.073
1859,TaneliT,2017-10-20 02:56,0,0,happy death day murmelina perusidea liki,,,921268948041072641,-0.0516,0.336,0.319,0.345
1860,ayooovi,2017-10-20 02:56,0,1,happy death day,,,921268819766607878,-0.0516,0.453,0.43,0.116
1861,AmourSharDae_,2017-10-20 02:55,2,3,wanna see boo happy death day,,,921268709326577664,-0.0516,0.336,0.319,0.345
1862,Rinidobyun,2017-10-20 02:54,0,0,mau nonton happy death day tapi takut ntar malah ga jelas,,,921268464341327873,-0.0516,0.235,0.223,0.542
1863,caulyadams,2017-10-20 02:54,0,0,seeing happy death day later,,,921268283608850432,-0.0516,0.368,0.349,0.283
1864,lvkngary,2017-10-20 02:53,0,1,happy death day aujiiii,,,921268053895024640,-0.0516,0.406,0.385,0.208
1865,kashime05,2017-10-20 02:53,0,1,happy death day,,,921268010333085696,-0.0516,0.453,0.43,0.116
1866,Gem_Hill,2017-10-20 02:52,0,8,last runthrough talk today old pool tournament happy death day tomorrow,,#TestBashManchester,921267854367973376,-0.0516,0.235,0.223,0.542
1867,ClawdiaLui,2017-10-20 02:52,0,2,lol christian hella laughing girl way happy death day,,,921267821002113024,0.7264,0.206,0.529,0.265
1868,Who_the_chel,2017-10-20 02:52,0,2,happy death day scary movies watch scared fantastic,,,921267770125295616,-0.4019,0.493,0.36,0.148
1869,hblwebb,2017-10-20 02:52,0,1,happy death day en inte rysarvariant av hela veckan,,,921267762340737024,-0.0516,0.267,0.253,0.479
1870,zacharyleo34,2017-10-20 02:52,0,0,watched happy death day wait see next,@jessica_rothe,,921267747878825984,-0.0516,0.31,0.294,0.397
1871,kcskino,2017-10-20 02:51,0,0,happy death day v,,,921267667499212800,-0.0516,0.453,0.43,0.116
1872,Neil_McNeil,2017-10-20 02:50,1,39,happy death day greatest murder romcom demand sequels extended universe,,,921267330759512064,-0.296,0.439,0.343,0.217
1873,kangaske,2017-10-20 02:48,0,0,happy death day murmelina perusidea liki,,,921266818437787648,-0.0516,0.336,0.319,0.345
1874,Friskydolan,2017-10-20 02:48,0,2,happy death day good movie,,,921266817187831808,0.4019,0.312,0.528,0.16
1875,vierraniaagung,2017-10-20 02:46,0,0,watching happy death day dedy,@cinema21,,921266421543211008,-0.0516,0.368,0.349,0.283
1876,clipsonlinetv,2017-10-20 02:45,0,1,box happy death day takes blade runner,,#Movies #Film,921266222515310592,-0.0516,0.31,0.294,0.397
1877,sialatuur,2017-10-20 02:45,0,2,someone watch happy death day bad genius ples,,,921266153271341056,-0.5719,0.46,0.23,0.311
1878,McNastyPrime,2017-10-20 02:45,2,0,tune tonight join review talk trailer,@BFMradio @AtTheMoviesMY,#Flatliners #HappyDeathDay #BlackPanther,921266095599652864,0.296,0.0,0.306,0.694
1879,HeyAndreeeey,2017-10-20 02:44,0,10,movie date happiness,,#Geostorm4Dx #HappyDeathDay,921265933389139968,0.5574,0.0,0.643,0.357
1880,cinemazine,2017-10-20 02:43,2,0,looking reviews,,#Geostorm #HappyDeathDay #MyLittlePonyMovie,921265725771313154,0.0,0.0,0.0,1.0
1881,keanxcole,2017-10-20 02:41,0,0,someone watch happy death day please,,,921265164023840768,0.2732,0.302,0.465,0.233
1882,chloemanook7,2017-10-20 02:40,0,3,currently watching happy death day longgadog family,,,921264915418976256,-0.0516,0.31,0.294,0.397
1883,syedsyazwan4,2017-10-20 02:38,0,0,happy death day,@TGVCinemas,,921264277704585216,-0.0516,0.453,0.43,0.116
1884,Fidel0808,2017-10-20 02:37,0,0,happy death day confusing,,,921264184079220736,-0.2732,0.552,0.352,0.095
1885,fzbkr,2017-10-20 02:37,0,0,happy death day mcm,,,921264128609550337,-0.0516,0.406,0.385,0.208
1886,ItsCarlston,2017-10-20 02:37,0,0,still wanted see snowman movie heard bad still want see happy death day,,,921264128408281088,-0.5267,0.346,0.234,0.421
1887,hakamzali,2017-10-20 02:36,0,0,happy death day kind boring already know plot twist,,,921263960653025280,0.2263,0.339,0.388,0.273
1888,Ba3syiaa,2017-10-20 02:34,0,4,happy death day date org paling ayu skrg,,,921263413803630592,-0.0516,0.287,0.272,0.441
1889,Motorburn,2017-10-20 02:34,0,0,happy death day trashy,,,921263268211183616,-0.0516,0.406,0.385,0.208
1890,memeburn,2017-10-20 02:34,0,0,happy death day trashy,,,921263266147569664,-0.0516,0.406,0.385,0.208
1891,1zerozero4,2017-10-20 02:33,0,7,watch happy death day,,,921263148870406144,-0.0516,0.406,0.385,0.208
1892,ppendesarapen,2017-10-20 02:33,0,0,showing na happy death day taraaaa,,,921263144076427264,-0.0516,0.336,0.319,0.345
1893,kayley_balasis,2017-10-20 02:32,0,1,cried real tears watching happy death day,,,921262764672380928,-0.5719,0.556,0.245,0.199
1894,dubvNOW,2017-10-20 02:30,0,0,scary thing hollywood runs reboots happy death day movie,,,921262430231121920,-0.5267,0.423,0.22,0.357
1895,Shatteredlies,2017-10-20 02:30,0,0,want watch happy death day already know plot gonna like,,,921262365261283328,0.3818,0.224,0.431,0.345
1896,favflicks1,2017-10-20 02:30,0,0,clever way happy death day decided reference groundhog spoiler following article,,,921262297661788160,0.4215,0.21,0.36,0.43
1897,molldg,2017-10-20 02:27,0,2,surprisingly big plot recommend,,#HappyDeathDay,921261624878497793,0.5719,0.0,0.701,0.299
1898,ak_blu3eyedbabe,2017-10-20 02:27,0,1,happy death day,,,921261507668668416,-0.0516,0.453,0.43,0.116
1899,ezzatiyuziman,2017-10-20 02:26,0,0,happy death day,,#nw,921261402332860416,-0.0516,0.453,0.43,0.116
1900,princessjazzB,2017-10-20 02:26,0,0,happy death day manan aw,,,921261350608830464,-0.0516,0.368,0.349,0.283
1901,HorrorVixen__,2017-10-20 02:25,3,21,went see happy death day course dug cause,@bridgetblonde,,921261006374031366,-0.0516,0.287,0.272,0.441
1902,neelnanda,2017-10-20 02:24,2,8,happy death day worst movie ever seen currently theater tweeting,,,921260911406358528,-0.6486,0.428,0.198,0.374
1903,Falsieto,2017-10-20 02:24,0,3,watched figured killer minutes movie watch horror movies damn much,,#HappyDeathDay,921260810810179585,-0.8934,0.605,0.0,0.395
1904,AllesKlar71,2017-10-20 02:21,0,0,happy death day showing convenient time monday local,@ODEONCinemas,,921260082435903488,-0.0516,0.287,0.272,0.441
1905,feaverss,2017-10-20 02:21,0,0,happy death day annoying yeah entertaining fkn annoying omg waste time money,,,921260050408267776,-0.5106,0.467,0.34,0.193
1906,obrienjohnjack,2017-10-20 02:19,0,5,michael happy death day give gay italian romance,,,921259589886099456,0.5267,0.241,0.451,0.309
1907,SophiaNoelle4,2017-10-20 02:19,0,3,man happy death day clarify talking carter would hate,,,921259461876109312,-0.5994,0.439,0.214,0.347
1908,abbishh__,2017-10-20 02:17,0,0,happy death day annoying ass movie recommend watch,,,921259086590676992,-0.5994,0.523,0.321,0.155
1909,MichaelVarrati,2017-10-20 02:17,0,4,still need see happy death day,,,921258937290178560,-0.0516,0.336,0.319,0.345
1910,zharfanaliyan17,2017-10-20 02:16,0,9,lets pray happy death day ni best kalau tak rugi duit,,,921258892184522752,0.743,0.185,0.483,0.332
1911,isakazarah,2017-10-20 02:15,0,0,blast watching happy death day doubts first fucking fun fun fun,,,921258667986501632,0.8548,0.238,0.566,0.195
1912,KINGSABRINAA,2017-10-20 02:12,0,10,happy death day good roasted crocs,,,921257896683466753,0.4019,0.289,0.489,0.222
1913,Katiex_Amnae,2017-10-20 02:12,0,1,nood us happy death day money,@Ivonne_Btrz,,921257718978973696,-0.0516,0.336,0.319,0.345
1914,fatinadilla6,2017-10-20 02:11,0,1,tak sabar nak tengok happy death day nih,,,921257614184296448,-0.0516,0.287,0.272,0.441
1915,WMMANews,2017-10-20 02:10,0,2,saw funny nice twist spoiler want people know song,,#HappyDeathDay,921257304472698880,0.7184,0.0,0.538,0.462
1916,WOOJINDCH,2017-10-20 02:10,0,0,happy death day bagus ga,,,921257268112343040,-0.0516,0.368,0.349,0.283
1917,marianatvf,2017-10-20 02:10,0,2,also happy death day pretty good,,,921257185740500992,0.7096,0.248,0.624,0.127
1918,ohhhitsnneka,2017-10-20 02:09,0,0,nah happy death day jokes,,,921257156141338624,0.1027,0.442,0.475,0.083
1919,nfdeklerk,2017-10-20 02:08,0,0,happy death day trashy,,,921256724010553344,-0.0516,0.406,0.385,0.208
1920,nazifaamhd,2017-10-20 02:06,0,0,nak tengok happy death day mcm best je trailer,,,921256201999998976,0.6124,0.219,0.444,0.337
1921,izzat_saupi,2017-10-20 02:04,0,1,happy death day ni dah mcm edge tomorrow pulak aku tengok,,,921255889792675840,-0.0516,0.235,0.223,0.542
1922,transmanszxcv,2017-10-20 02:04,0,0,happy death day na ba itu,,,921255879864807424,-0.0516,0.336,0.319,0.345
1923,_Mariasison,2017-10-20 02:04,0,0,ohhhhh happy death day,,,921255679226028032,-0.0516,0.406,0.385,0.208
1924,youngpaps24,2017-10-20 02:02,0,3,happy death day bad,,,921255344520564736,-0.5719,0.612,0.306,0.083
1925,perfuection,2017-10-20 02:02,0,0,akhirnya happy death day,,,921255192804200448,-0.0516,0.406,0.385,0.208
1926,damnhaughtt,2017-10-20 02:01,0,1,great think song made better though,@ddlovato,#HappyDeathDay,921255113620054016,0.7906,0.0,0.636,0.364
1927,Godarui,2017-10-20 02:00,0,2,every time white bitch got killed happy death day,,,921254748518576128,-0.8591,0.584,0.177,0.239
1928,chelseaacheeks_,2017-10-20 02:00,0,1,could watch happy death day,,,921254730994565120,-0.0516,0.368,0.349,0.283
1929,chescafrxn,2017-10-20 02:00,0,0,happy death day,,,921254715295399936,-0.0516,0.453,0.43,0.116
1930,ilovesureseats,2017-10-20 02:00,0,3,watch trailer fill,,#HappyDeathDay,921254660660514816,0.0,0.0,0.0,1.0
1931,Godarui,2017-10-20 01:59,0,0,happy death day trash,,,921254475683323904,-0.0516,0.406,0.385,0.208
1932,hikarieshinie,2017-10-20 01:58,0,1,happy death day,,,921254285828022273,-0.0516,0.453,0.43,0.116
1933,iNjhhNzrdn,2017-10-20 01:58,0,0,happy death day,,,921254213094481920,-0.0516,0.453,0.43,0.116
1934,Sdeltean,2017-10-20 01:57,0,0,mcm best ja happy death day ni,,,921254088645402624,0.6124,0.247,0.5,0.253
1935,hikarieshinie,2017-10-20 01:57,0,0,happy death day,,,921253968805629952,-0.0516,0.453,0.43,0.116
1936,carmelavidal_,2017-10-20 01:56,0,1,di ko alam kung san ako nakahugot ng lakas ng loob manood ng happy death day magisa,,,921253792607121409,-0.0516,0.173,0.164,0.664
1937,muhdkhairulanam,2017-10-20 01:55,0,0,happy death day,,#kacangmovierating,921253540210737152,-0.0516,0.453,0.43,0.116
1938,kateyar2,2017-10-20 01:55,0,0,daily routine,,#happydeathday,921253527904649216,0.0,0.0,0.0,1.0
1939,claiirbeaar92,2017-10-20 01:52,0,0,cheers mom fantastic taste liquor,,#HappyDeathDay #InvisibleSadness,921252800859865088,0.7717,0.0,0.691,0.309
1940,drewf000,2017-10-20 01:51,0,0,happy death day really good besides one little thing,,,921252525642272768,0.4576,0.232,0.41,0.357
1941,cantberepIaced,2017-10-20 01:50,0,1,man happy death day run like christian,,,921252385791533056,0.3182,0.277,0.44,0.284
1942,Blair_Hoyle,2017-10-20 01:49,0,3,fetish horror movies starching franchise movies box hell happy death day,,,921252055787950081,-0.8591,0.533,0.162,0.306
1943,TStape03,2017-10-20 01:48,0,3,happy death day honesty really go check,,,921251703420215296,0.4588,0.264,0.466,0.27
1944,ZZAILEENN,2017-10-20 01:47,0,0,happy death day review rate pls ppl pronto tell,,,921251586738757632,0.0258,0.262,0.336,0.403
1945,btsgmfu,2017-10-20 01:47,0,3,happy death day confusing,,,921251530107273216,-0.2732,0.552,0.352,0.095
1946,LastTheaterLeft,2017-10-20 01:46,0,0,signal return slasher check latest review find,,#HappyDeathDay,921251276234600448,0.0,0.0,0.0,1.0
1947,carmelitesDC,2017-10-20 01:46,0,0,happy death day latur,,,921251246681362432,-0.0516,0.406,0.385,0.208
1948,alysareyes_,2017-10-20 01:45,0,6,happy death day recommend,,,921250898239557632,0.3182,0.351,0.559,0.09
1949,lyonceknowles,2017-10-20 01:44,0,0,said gonna watch happy death day today noooo lazy,,,921250751308996608,-0.4019,0.398,0.23,0.373
1950,GabrielleIrvin,2017-10-20 01:44,0,2,happy death day cheesy liked,,,921250638192889856,0.3818,0.315,0.524,0.161
1951,NefaF,2017-10-20 01:40,0,0,watching happy death day leanora widya central,,,921249659221196801,-0.0516,0.31,0.294,0.397
1952,timetraveltrio,2017-10-20 01:39,5,2,anyone seen time another type let us,,#happydeathday #timetravel,921249592888451072,0.0,0.0,0.0,1.0
1953,TaylorTormos,2017-10-20 01:39,0,1,happy death day amazing,,,921249494724902912,0.5574,0.315,0.605,0.081
1954,erikatoni11,2017-10-20 01:36,0,0,happy death day cdo downtown premier cinema cagayan de misamis oriental,@Sm @asdfghjklanie,,921248786613141504,-0.0516,0.235,0.223,0.542
1955,lesphinxayy,2017-10-20 01:36,0,0,moral story happy death day bij,,,921248715578462208,-0.0516,0.336,0.319,0.345
1956,rocaa_sn,2017-10-20 01:35,0,0,happy death day lit af kid,,,921248429904355328,-0.0516,0.336,0.319,0.345
1957,Neroboi2,2017-10-20 01:34,0,0,box office glory piece cake death,,#8216 #8217,921248330637873153,-0.1027,0.342,0.307,0.351
1958,randistinson_,2017-10-20 01:34,0,1,wanna go see happy death day,,,921248323620683776,-0.0516,0.336,0.319,0.345
1959,Taylorg0522,2017-10-20 01:34,0,0,happy death day good ass movie tbh would recommend,,,921248226493304832,0.1779,0.361,0.444,0.195
1960,the_noceur,2017-10-20 01:32,0,0,went movies earlier saw pretty,,#HappyDeathDay,921247724175020032,0.4939,0.0,0.444,0.556
1961,nurafifaqilla,2017-10-20 01:32,0,0,happy death day laa please,,,921247620026179584,0.2732,0.328,0.504,0.168
1962,atmilner07,2017-10-20 01:29,0,1,better movie watch,,#HappyDeathDay,921246990457065472,0.4404,0.0,0.592,0.408
1963,writtenbysara,2017-10-20 01:29,0,0,cast member shoots death scene think say happy death day,,,921246931191349249,-0.6249,0.422,0.2,0.378
1964,carozariel,2017-10-20 01:29,0,0,wanna watch happy death day,,,921246917266309120,-0.0516,0.368,0.349,0.283
1965,TheHorrorGuru,2017-10-20 01:28,0,4,needing explanation ending happy death day like needing groundhog day,,,921246802547949571,0.3182,0.228,0.363,0.409
1966,TheHorrorGuru,2017-10-20 01:27,1,6,happy death day ending pretty damn straight forward fuck asking,,,921246518165639170,-0.3182,0.441,0.384,0.175
1967,JurassicGriffin,2017-10-20 01:26,0,0,less seen happy death day,,,921246284362780673,-0.0553,0.362,0.34,0.298
1968,RyanG0esHam,2017-10-20 01:25,0,0,happy death day pretty shabby,,,921245872343707648,0.4588,0.305,0.539,0.156
1969,guanIin,2017-10-20 01:24,0,4,happy death day really good one best horror movies watched far,,,921245823660302336,0.5799,0.305,0.455,0.24
1970,Pettinessa,2017-10-20 01:24,0,0,happy death day really good,,,921245797164965888,0.4576,0.305,0.539,0.156
1971,treenisa,2017-10-20 01:24,0,0,watch flatliners awesome bae like happy death day,,,921245702025494528,0.7506,0.214,0.566,0.22
1972,snipsnapyappap,2017-10-20 01:23,0,0,except see happy death day recommend pretty,,,921245522312118272,0.6705,0.239,0.577,0.184
1973,shxrmhl,2017-10-20 01:22,0,0,happy death day muna,,,921245276500668416,-0.0516,0.406,0.385,0.208
1974,lellzz19,2017-10-20 01:22,0,2,mcm best je cite happy death day ni,,,921245198360854535,0.6124,0.232,0.47,0.298
1975,annetakaaaaaaw,2017-10-20 01:19,0,0,happy death day movie trip laturrrrr,,,921244475099308032,-0.0516,0.336,0.319,0.345
1976,Mystical_Casper,2017-10-20 01:19,0,0,high fucc movie theatre alone watch happy death day lulz c wut hype kid,,,921244430220357632,0.2023,0.273,0.31,0.417
1977,dragdragons,2017-10-20 01:19,0,0,happy death day looks good,,,921244392781791232,0.4019,0.312,0.528,0.16
1978,eteerxmok,2017-10-20 01:17,0,2,want watch happy death day boh friends hahahaaha loner,,,921244030310035456,0.2263,0.339,0.443,0.219
1979,imcouleeny_,2017-10-20 01:16,0,1,torn bad genius happy death day,,,921243625924595713,-0.6908,0.623,0.245,0.132
1980,alyaaafarhana,2017-10-20 01:15,0,3,wanna watch happy death day badly,,,921243476766760960,-0.5106,0.511,0.27,0.219
1981,bryanbrown84_bb,2017-10-20 01:14,0,4,happy death day relives day getting murdered every feel like real curse would watching movie,,,921243298597019648,-0.765,0.421,0.221,0.357
1982,__daskeii,2017-10-20 01:14,0,1,still wanna see happy death day,,,921243106309062656,-0.0516,0.336,0.319,0.345
1983,nasuhanina,2017-10-20 01:13,0,0,sumpah balik sana nak tengok flatliners happy death day escape room ah semua ah,,,921243002164543488,0.128,0.192,0.266,0.542
1984,rafmoses,2017-10-20 01:13,0,2,read good review happy death day think plus blum house killing,,,921242957155418112,-0.4019,0.379,0.301,0.32
1985,babypinktotebag,2017-10-20 01:12,0,0,wow happy death day good,,,921242586831929347,0.7579,0.255,0.68,0.065
1986,ItsmeBrandonW,2017-10-20 01:11,0,0,seen happy death day really really liked,,,921242489591177217,0.489,0.26,0.472,0.267
1987,nr_dianaa,2017-10-20 01:11,0,1,boleh tahan laa happy death day,,,921242489037533184,-0.0516,0.336,0.319,0.345
1988,PakuJamur,2017-10-20 01:10,0,0,happy death day kak,,,921242130164494337,-0.0516,0.406,0.385,0.208
1989,shampeynpapi,2017-10-20 01:09,0,3,gusto ko panoorin happy death day kaya bad genius,,,921241886085431296,-0.5719,0.433,0.216,0.351
1990,sara_raw,2017-10-20 01:07,0,0,felt like detective figuring killer protagonist happy death day lol,,,921241438611894273,-0.0516,0.369,0.405,0.225
1991,esmatullahhaid3,2017-10-20 01:03,0,0,watching happy death day edwards irvine spectrum imax rpx,,,921240525969039360,-0.0516,0.267,0.253,0.479
1992,ctempleton9,2017-10-20 01:03,0,4,need someone watch happy death day,,,921240499146563584,-0.0516,0.336,0.319,0.345
1993,etherealovato,2017-10-20 01:03,0,0,watching happy death day bc u,@ddlovato,,921240338567544832,-0.0516,0.368,0.349,0.283
1994,angel_leXO,2017-10-20 01:01,0,5,thought gay cowboy campus story plot let tell happy death day,,,921239944760246273,-0.0516,0.235,0.223,0.542
1995,thaanamesleon,2017-10-20 01:00,0,0,happy death day extra af,,,921239599288000518,-0.0516,0.368,0.349,0.283
1996,hiqueenk,2017-10-20 00:58,0,0,actually really good movie,,#HappyDeathDay,921239290641657857,0.4927,0.0,0.516,0.484
1997,MichelleC2016,2017-10-20 00:58,0,1,happy death day,,,921239243095121921,-0.0516,0.453,0.43,0.116
1998,Dhiya_Hafizah,2017-10-20 00:58,0,0,happy death day bommmm plot twist,,,921239145984401408,-0.0516,0.336,0.319,0.345
1999,trinityamiah,2017-10-20 00:58,0,2,going go see happy death day excited,,,921239075285213184,0.296,0.279,0.436,0.286
